{
  "$schema": "https://json-schema.org/draft/2020-12/schema",
  "$id": "urn:living-history:schema:scheduled-effect-event:1.0",
  "title": "ScheduledEffectEvent",
  "type": "object",
  "additionalProperties": false,
  "required": [
    "schemaVersion",
    "eventId",
    "atElapsedSeconds",
    "order",
    "sourceId",
    "kind",
    "payload"
  ],
  "properties": {
    "schemaVersion": { "const": "1.0" },
    "eventId": { "$ref": "#/$defs/id" },
    "atElapsedSeconds": {
      "type": "integer",
      "minimum": 0,
      "maximum": 9007199254740991
    },
    "order": {
      "type": "integer",
      "minimum": 0,
      "maximum": 9007199254740991
    },
    "sourceId": { "$ref": "#/$defs/id" },
    "kind": { "const": "core.effects" },
    "payload": {
      "type": "object",
      "additionalProperties": false,
      "required": ["effects"],
      "properties": {
        "effects": {
          "type": "array",
          "minItems": 1,
          "maxItems": 100,
          "items": { "$ref": "urn:living-history:schema:gameplay-effect:1.0" }
        }
      }
    }
  },
  "$defs": {
    "id": {
      "type": "string",
      "minLength": 1,
      "maxLength": 200
    }
  }
}
