{
  "schemaVersion": "1.0",
  "eventId": "event.paint-delivery",
  "atElapsedSeconds": 300,
  "order": 10,
  "sourceId": "task.paint-delivery",
  "kind": "core.effects",
  "payload": {
    "effects": [
      {
        "schemaVersion": "1.0",
        "type": "resource.change",
        "sourceId": "event.paint-delivery",
        "resourceId": "blue_paint",
        "delta": 2
      }
    ]
  }
}
